<!ELEMENT proveedores (proveedor+)>
<!ELEMENT proveedor (nombre, productos, telefono*)>
<!ELEMENT nombre (#PCDATA)>
<!ELEMENT productos (producto+)>
<!ELEMENT producto (#PCDATA)>
<!ELEMENT telefono (#PCDATA)>